{
  "$schema": "https://json-schema.org/draft/2020-12/schema",
  "$id": "task.schema.json",
  "title": "K-pi task",
  "type": "object",
  "required": [
    "job_id",
    "mode",
    "goal",
    "nongoals",
    "acceptance",
    "constraints",
    "quality_gates",
    "ac"
  ],
  "properties": {
    "job_id": {
      "type": "string",
      "pattern": "^[a-z0-9]+(?:-[a-z0-9]+)*$",
      "maxLength": 128
    },
    "mode": {
      "enum": ["gated", "autopilot"]
    },
    "goal": {
      "type": "string",
      "minLength": 1
    },
    "nongoals": {
      "type": "array",
      "items": { "type": "string" }
    },
    "acceptance": {
      "type": "array",
      "items": { "$ref": "#/$defs/acceptanceCriterion" }
    },
    "constraints": {
      "type": "array",
      "items": { "type": "string" }
    },
    "quality_gates": {
      "type": "array",
      "items": { "type": "string", "minLength": 1 }
    },
    "ac": {
      "type": "object",
      "required": ["quality"],
      "properties": {
        "quality": {
          "enum": ["executable", "partial", "narrative"]
        }
      },
      "additionalProperties": false
    },
    "playbook": {
      "type": "string",
      "minLength": 1
    },
    "playbook_steps": {
      "type": "array",
      "minItems": 1,
      "items": { "$ref": "#/$defs/playbookStep" }
    },
    "runtime_dependencies": {
      "type": "array",
      "items": { "type": "string", "minLength": 1 }
    },
    "dependency_baseline": {
      "type": "array",
      "items": { "type": "string", "minLength": 1 }
    },
    "current_module_id": {
      "type": "string",
      "minLength": 1
    },
    "research_network": { "enum": ["auto", "offline"] },
    "intent_details": {
      "type": "object",
      "required": ["users", "journeys"],
      "properties": {
        "users": { "type": "array", "items": { "type": "string" } },
        "journeys": { "type": "array", "items": { "type": "object" } }
      },
      "additionalProperties": true
    }
  },
  "dependentRequired": {
    "playbook": ["playbook_steps"],
    "playbook_steps": ["playbook"]
  },
  "$defs": {
    "playbookStep": {
      "type": "object",
      "required": ["node", "text"],
      "properties": {
        "node": { "type": "string", "minLength": 1 },
        "text": { "type": "string", "minLength": 1 },
        "skip": { "type": "string", "minLength": 1 }
      },
      "additionalProperties": false
    },
    "acceptanceCriterion": {
      "type": "object",
      "required": ["id", "statement", "required"],
      "properties": {
        "id": { "type": "string", "minLength": 1 },
        "statement": { "type": "string", "minLength": 1 },
        "required": { "type": "boolean" },
        "check": { "$ref": "#/$defs/acceptanceCheck" },
        "bounds": { "$ref": "#/$defs/acceptanceBounds" }
      },
      "additionalProperties": false
    },
    "acceptanceCheck": {
      "type": "object",
      "required": ["kind"],
      "properties": {
        "kind": {
          "enum": [
            "command",
            "file_exists",
            "file_absent",
            "grep_empty",
            "grep_matches",
            "json_path",
            "http_probe"
          ]
        },
        "cmd": { "type": "string", "minLength": 1 },
        "path": { "type": "string", "minLength": 1 },
        "pattern": { "type": "string" },
        "pointer": { "type": "string", "pattern": "^(|/.*)$" },
        "equals": {},
        "url": { "type": "string", "minLength": 1 },
        "status": { "type": "integer", "minimum": 100, "maximum": 599 },
        "timeout_ms": { "type": "integer", "minimum": 1, "maximum": 30000 },
        "max_bytes": { "type": "integer", "minimum": 1, "maximum": 16777216 },
        "expect": {
          "type": "object",
          "properties": {
            "exit": { "type": "integer" },
            "stdout_includes": {
              "type": "array",
              "items": { "type": "string" }
            }
          },
          "additionalProperties": false
        }
      },
      "additionalProperties": true
    },
    "acceptanceBounds": {
      "type": "object",
      "properties": {
        "write_allow": {
          "type": "array",
          "items": { "type": "string", "minLength": 1 }
        },
        "write_deny": {
          "type": "array",
          "items": { "type": "string", "minLength": 1 }
        }
      },
      "additionalProperties": false
    }
  },
  "additionalProperties": false
}
