{
  "job_id": "2026-09-02-dune-top-level-generic",
  "mode": "gated",
  "goal": "Ship the helpers the plan filed under a top-level src/utils home",
  "nongoals": [
    "checkout"
  ],
  "acceptance": [
    {
      "id": "AC-01",
      "statement": "the helpers are covered by tests and npm test exits 0",
      "required": true,
      "check": {
        "kind": "command",
        "cmd": "npm test",
        "expect": {
          "exit": 0
        }
      },
      "bounds": {
        "write_allow": [
          "src/utils/**",
          "test/utils/**"
        ]
      }
    }
  ],
  "constraints": [
    "no new runtime dependency"
  ],
  "quality_gates": [
    "npm test"
  ],
  "ac": {
    "quality": "executable"
  },
  "current_module_id": "utils"
}
