{
  "job_id": "2026-09-02-dune-top-level-layer",
  "mode": "gated",
  "goal": "Ship the checkout endpoints the plan filed under a top-level src/api layer",
  "nongoals": [
    "catalog"
  ],
  "acceptance": [
    {
      "id": "AC-01",
      "statement": "the checkout endpoint answers 200 and npm test exits 0",
      "required": true,
      "check": {
        "kind": "command",
        "cmd": "npm test",
        "expect": {
          "exit": 0
        }
      },
      "bounds": {
        "write_allow": [
          "src/api/**",
          "test/api/**"
        ]
      }
    }
  ],
  "constraints": [
    "no new runtime dependency"
  ],
  "quality_gates": [
    "npm test"
  ],
  "ac": {
    "quality": "executable"
  },
  "current_module_id": "api"
}
